{
  "checks": {
    "claim_grounding_rows_complete": true,
    "live_attribution_proof_bound": true,
    "live_attribution_proof_l165_ready": true,
    "negative_response_fixtures_reject": true,
    "production_invocation_admission_bound": true,
    "production_invocation_admission_l170_ready": true,
    "response_surface_rows_complete": true,
    "settlement_release_rows_complete": true,
    "source_category_rows_complete": true,
    "source_grounded_response_receipt_signed": true
  },
  "claim_grounding_rows": {
    "answer_claim": {
      "citation_locator_hash": "a9d2db96f0a2e5ec9ce9e0d6312fd468b41f8ecac3e608e8833939ff1d6e5c5f",
      "citation_metadata_verified": true,
      "claim_hash": "23682b20ff571b8a9904d81727d16e7a11d29c7a1953658cac1def235ad512ca",
      "claim_row_hash": "0e8ae383f9063e074cd8f577e3aef8930dda8308147aaa4253b3506fe3a78953",
      "claim_type": "answer_claim",
      "confidence_hash": "2bef2ba834ef27bd38de39137c8af0533763758458a6568ab3d0666f93278d47",
      "evidence_span_bound": true,
      "evidence_span_hash": "4131e225a37e14ccbe3bdde968e76c6478fcde65295ba8005771ef8af927c70d",
      "no_private_payloads": true,
      "source_row_hash": "af5c05d3b8783c813722a79ccbda7df0309d6f451dd7cc6a99989fd27da0e979",
      "source_visible_in_footer": true,
      "supported_by_source": true,
      "unsupported_claim_blocked": true,
      "verifier_hash": "8241c5ec9910769ce944f595767b29413194ff2cbb104695458076905d04c8dc"
    },
    "citation_claim": {
      "citation_locator_hash": "4c15d89b72040cb7175ec7138e46b6a13e561cffa150f87cd93e35c5eb434cb7",
      "citation_metadata_verified": true,
      "claim_hash": "cec4dde9361748a4e35cc0d304f2433c5e8f1d725d12f2d202822e35af9c91d9",
      "claim_row_hash": "8374b71afedd9ed59522616b561831de22dbe7884aa2925576c484ac9fc43463",
      "claim_type": "citation_claim",
      "confidence_hash": "fa88b41c6a22ee742e7113bb9c7af04bda4be38c0d6eddaddd37c2938b808695",
      "evidence_span_bound": true,
      "evidence_span_hash": "ec32550f5ff62ebf66fe6542b35608a5d680d3db413309dcc5b76a3a210ff83c",
      "no_private_payloads": true,
      "source_row_hash": "576cdc48952c346ea6236add2cca1209278186136c72185e0c5067e7c7308624",
      "source_visible_in_footer": true,
      "supported_by_source": true,
      "unsupported_claim_blocked": true,
      "verifier_hash": "37319f20198a8124ad56c2dd31c6c4f754f0f673aa438928ce6c16036026c253"
    },
    "code_claim": {
      "citation_locator_hash": "929fcdd8f06e99dbdee31ad79bedd34f87235afe10d1534936792a9ebd37f13d",
      "citation_metadata_verified": true,
      "claim_hash": "8e0cb97ea41cfb7e041b9216afd4440cc157fe5c1da4b9f65b94eb310835c343",
      "claim_row_hash": "0693ea4febe97f23bd1dfada6a28f002ac2ed117883fe4329a59bbead593c842",
      "claim_type": "code_claim",
      "confidence_hash": "b1810bc8c3230243e5ee3b9ea1877027f35b6a8c109e2eb077d6f226d0f07e2d",
      "evidence_span_bound": true,
      "evidence_span_hash": "e919f3e55885807ff016e0f50e3a6318578c9a8e9c9cbf56d3e2cb319f6e2452",
      "no_private_payloads": true,
      "source_row_hash": "698ecf812beceec0612f870b928013e4a41d8b10ad5d9f8751b636a7fafbb2df",
      "source_visible_in_footer": true,
      "supported_by_source": true,
      "unsupported_claim_blocked": true,
      "verifier_hash": "d1dd1be31a7febcb64467d3b89b653b511e8ed4a997333536d7c8fea4863c4f2"
    },
    "comparative_claim": {
      "citation_locator_hash": "aff6e3e5ea11b98e89eaed3254a83f978d58bf21315e1bf403223e6919ae2225",
      "citation_metadata_verified": true,
      "claim_hash": "01520bb442e51a547fdef1ac97512af7dfc71ca46e760145d4305dbbfdc95a25",
      "claim_row_hash": "56b532f1c44ca1f03f5dd5e4321b8a5ca29ddefeac964356b91ce5900507ee50",
      "claim_type": "comparative_claim",
      "confidence_hash": "f4d2731c38645ebf0bd8f6ed33c0d35bb34ca8a321d7c9c21cc797e5b9fbe4c9",
      "evidence_span_bound": true,
      "evidence_span_hash": "131083f2574d6b0ab2396d348538ad276d78641b2d3bbc891f6081a1a18d1b56",
      "no_private_payloads": true,
      "source_row_hash": "df1546712a05f9975c567c4790a8b0998ab025b6504bb5649c3315a6dddaa9d1",
      "source_visible_in_footer": true,
      "supported_by_source": true,
      "unsupported_claim_blocked": true,
      "verifier_hash": "352e4145846d4da869eea8e25362cf85ad692a6e64e7d6bf223fc0b8f1ffe6cc"
    },
    "factual_claim": {
      "citation_locator_hash": "87b224a6240b3b151b6f90423f462571cea822b67c226e4952cfaafd9a7a83b5",
      "citation_metadata_verified": true,
      "claim_hash": "c8b3307cf890d100dccb3c16ba49d82e4901530e38adbd60ed5f6a661e91ab71",
      "claim_row_hash": "08803829e69a786234cabbae7b9de4c714fb5ed78af97ce1d76c5f64f2998ae7",
      "claim_type": "factual_claim",
      "confidence_hash": "7845841c48a1d8a42d39d0c6100bc6d12e257f877849a590af3dc1dc2725ab78",
      "evidence_span_bound": true,
      "evidence_span_hash": "b9e3894ef6b81ef77867aac3e5cc6d3977c584ade20625943bb594743475d956",
      "no_private_payloads": true,
      "source_row_hash": "6abe1c037b4d923451f66b3342af1b0a85d6391c5531619317d94709ce960d66",
      "source_visible_in_footer": true,
      "supported_by_source": true,
      "unsupported_claim_blocked": true,
      "verifier_hash": "4c72bf8f24e47a31a94607ee6388936721ca045d5bc2b3bf55ad7a48f4a7b0ad"
    },
    "media_claim": {
      "citation_locator_hash": "4c7b737265b67d84f54a7da922ea8cfcda5798bdd7b307429a31929b891fe621",
      "citation_metadata_verified": true,
      "claim_hash": "d89a79671aacbdf1b84fd301068fe37f9fa4277857fdc3e938dfda4a2e0847b8",
      "claim_row_hash": "d262224b82a76ca7e8d950b266af7172908edbea1186ded606b00d0d94380ed1",
      "claim_type": "media_claim",
      "confidence_hash": "3d7153a20a01c2b024efae7eb41d60cd9dc433ba8a3e5ca17b06b0902c9f115f",
      "evidence_span_bound": true,
      "evidence_span_hash": "0b63ab5e2ded3f3a51539e47d8ebbbeb115e6dbe3c43b3bf88f958c94d03d34b",
      "no_private_payloads": true,
      "source_row_hash": "8a9381882b49a0382ee66b2a660aa35ba85c9937233ce6ea50fa4c5c21ca4bdb",
      "source_visible_in_footer": true,
      "supported_by_source": true,
      "unsupported_claim_blocked": true,
      "verifier_hash": "4b37591bbc91bb8a95bc7baad4d6447c26acc4eb958780f59289606000c2fecc"
    },
    "no_source_abstention_claim": {
      "citation_locator_hash": "c3280ba2117c9a820aac73412fc6fe06883e3234123af0a2fa08e3296ac5265f",
      "citation_metadata_verified": true,
      "claim_hash": "969ffca6a0c41e6a72347cc367581048738e617ec589fb1b5253601cb4344ce8",
      "claim_row_hash": "c7fc36f6ff51cd75a5e155440ae2eb9ac4115ee598a2933822955eceefb1582e",
      "claim_type": "no_source_abstention_claim",
      "confidence_hash": "c88dc841cce03694302d97b229fd5ab4368f1c169a6000cd2dde3ee5a8ffd7ea",
      "evidence_span_bound": true,
      "evidence_span_hash": "c0c38c57dc07453bcfd600bf530a7f31b0a6c5ccdde94bbe340f3f62582ab7db",
      "no_private_payloads": true,
      "source_row_hash": "b215d9ffab9e2a86d3fbd9233658c47de88786b6458eca2dd908f053113d984b",
      "source_visible_in_footer": true,
      "supported_by_source": true,
      "unsupported_claim_blocked": true,
      "verifier_hash": "04a95e60806c5ea7d181e8c76dd2451ad438931c9fd4106285f72fdd616396d7"
    },
    "quotation_claim": {
      "citation_locator_hash": "37d6e7d88d3895f0370c84e8bfccfc54ebe7d0092c1437d8d9417ed46005067a",
      "citation_metadata_verified": true,
      "claim_hash": "423f8e33b182dc0fad5d1eafd65c6c43ea5dae01f0ef4baf6047e873d63f66cd",
      "claim_row_hash": "0835667915a2847bb449785e86c2ae2ccee32f9bc21497968104a2327357cc5c",
      "claim_type": "quotation_claim",
      "confidence_hash": "d8d4d61b0dfdf4dc27d09c7074c50d7d30f0661e85f5c2c75404fde0b16a1062",
      "evidence_span_bound": true,
      "evidence_span_hash": "513b088e90ad837274b02d09b417d89d11fdb8725e276c5b3d199f9719a5454b",
      "no_private_payloads": true,
      "source_row_hash": "5499f4f6abce78799ffefc46a7aea5e3250f5c5acc2d5c3cd01fb0852e788521",
      "source_visible_in_footer": true,
      "supported_by_source": true,
      "unsupported_claim_blocked": true,
      "verifier_hash": "16130627f9e35b45723975c0869061edd8ee5fb3a519a3d1e310d4877483672d"
    },
    "safety_or_policy_claim": {
      "citation_locator_hash": "2c950648cafc8595410c6d56dd0306f0cdc73636ca3ef043affcbde7ca1d01eb",
      "citation_metadata_verified": true,
      "claim_hash": "f06f9650031290fb909ec12ffb6f55924990693665ebed885b3d8bec04eb23a4",
      "claim_row_hash": "45c8017e288370170f6c6f04968b95192a973e05ebc35813a93de4ce9814d328",
      "claim_type": "safety_or_policy_claim",
      "confidence_hash": "e81d81a96fdf2850b46cb9de1cd1f38833308fbe0290e33ded65ad68f444e834",
      "evidence_span_bound": true,
      "evidence_span_hash": "04999df960c55cdb8e133c73fdcd090ecad49811106589e897aca6566281dfd0",
      "no_private_payloads": true,
      "source_row_hash": "169abd80919d91006b5e275a59082d2788defdc609783d976e13b92c8b1ec673",
      "source_visible_in_footer": true,
      "supported_by_source": true,
      "unsupported_claim_blocked": true,
      "verifier_hash": "46edbd21c04f8f7ffe25050395f3f411a9a76bd3a0fee8db050a55b07eff560e"
    },
    "summary_claim": {
      "citation_locator_hash": "3874c5af831e1b4ece9fba9f79e4f8dba6403318ff3d96dc07781c97a7b70327",
      "citation_metadata_verified": true,
      "claim_hash": "0e8afa9b8e5269c4a59df3084c28875df67b0bbf58b20bc14291e85164bbdcf9",
      "claim_row_hash": "802aa2040f35b2744fb97dbc89c9c1a2f8ae086022456e4c83038f5c3cc1338c",
      "claim_type": "summary_claim",
      "confidence_hash": "7b2b80eee7ecc66934e0dd291aab763aa0198d2b48100b301a2492ae5ca257a0",
      "evidence_span_bound": true,
      "evidence_span_hash": "665ce1554ef814a313958169185b8e8770813d6d47bd343e61bb16745f46bca1",
      "no_private_payloads": true,
      "source_row_hash": "a93fcec6e1d23090d233748a4970cbeaa60d71122cf205cab14d3325b8e6e219",
      "source_visible_in_footer": true,
      "supported_by_source": true,
      "unsupported_claim_blocked": true,